{
  "schema_version": "0.2.0",
  "updated_at": "2026-05-26T00:00:00Z",
  "profile_kind": "company",
  "tier": "public",
  "company": {
    "name": "My Agentic",
    "website": "https://my-agentic.com",
    "jurisdiction": "GB",
    "industry": [
      "agentic-ai",
      "long-running-agents",
      "ai-operations"
    ],
    "tagline": "Work for long-lived agentics.",
    "summary": "A public home for Tony Wood's practical work on long-lived agentic systems that stay useful, bounded, and reviewable."
  },
  "links": {
    "website": "https://my-agentic.com"
  },
  "contact": {
    "preferred_channel": "none"
  }
}
