{
  "schema_version": "0.2.0",
  "updated_at": "2026-05-26T00:00:00Z",
  "profile_kind": "company",
  "tier": "public",
  "company": {
    "name": "AI Operations Excellence",
    "website": "https://aiperations.com",
    "jurisdiction": "GB",
    "industry": [
      "ai-operations",
      "automation",
      "operational-excellence"
    ],
    "tagline": "Turn AI pilots into operating outcomes.",
    "summary": "AIperations is a simple operating home for the practical discipline that turns AI demos into adopted, measurable, governed work."
  },
  "links": {
    "website": "https://aiperations.com"
  },
  "contact": {
    "preferred_channel": "form",
    "form_url": "https://www.tonywood.org/advisory/?mtm_campaign=aiperations_to_tonywood_advisory&mtm_source=aiperations.com&mtm_medium=referral&mtm_content=profile_contact"
  }
}
