{
  "schema_version": "0.1.0",
  "updated_at": "2026-04-19T00:00:00Z",
  "locale": "en-GB",
  "profile_kind": "company",
  "tier": "public",
  "company": {
    "name": "Acme Robotics",
    "legal_name": "Acme Robotics Ltd",
    "website": "https://acme-robotics.example",
    "jurisdiction": "GB",
    "registry": {
      "type": "companies-house",
      "id": "12345678",
      "url": "https://find-and-update.company-information.service.gov.uk/company/12345678"
    },
    "lei": "213800ABCDEFGH123456",
    "founded": "2022-03",
    "industry": ["robotics", "b2b-saas", "industrial-automation"],
    "tagline": "Vision-language models for warehouse pick-and-place.",
    "summary": "Acme Robotics builds vision-language perception stacks that let off-the-shelf manipulators pick novel SKUs without per-item programming.",
    "logo_url": "https://acme-robotics.example/logo.png"
  },
  "stage": { "current": "Seed", "since": "2025-02" },
  "funding": {
    "total_raised_band": "1m-5m",
    "currency": "GBP",
    "last_round": {
      "stage": "Seed",
      "date": "2025-02",
      "amount_band": "1m-5m",
      "currency": "GBP",
      "lead_investor": "Northern Gravity",
      "evidence_url": "https://acme-robotics.example/news/seed-round"
    }
  },
  "team": {
    "headcount_band": "11-50",
    "key_people": [
      { "name": "Priya Shah", "role": "CEO & co-founder", "linkedin": "https://www.linkedin.com/in/example-priya" },
      { "name": "Tomas Berg", "role": "CTO & co-founder", "linkedin": "https://www.linkedin.com/in/example-tomas" }
    ]
  },
  "metrics": {
    "revenue_band": "100k-500k",
    "growth_band": "100-300%",
    "customers_band": "10-100",
    "as_of": "2026-03-31"
  },
  "evidence": [
    { "type": "filing", "url": "https://find-and-update.company-information.service.gov.uk/company/12345678/filing-history", "captured_at": "2026-04-10", "supports": "/company/registry" },
    { "type": "press", "url": "https://www.example.co.uk/news/acme-seed", "captured_at": "2025-02-15", "supports": "/funding/last_round" }
  ],
  "links": {
    "website": "https://acme-robotics.example",
    "linkedin": "https://www.linkedin.com/company/acme-robotics-example",
    "github": "https://github.com/acme-robotics-example"
  },
  "contact": {
    "preferred_channel": "form",
    "form_url": "https://acme-robotics.example/contact",
    "private_mcp": "https://private-mcp.acme-robotics.example/mcp",
    "notes": "For investor diligence requests, please use the form."
  }
}
